id	name	neighborhood	cuisine_type	pricing_tier	menu_tier	menu_price_range	menu_del_dia_confirmed	website	phone	address_full	postal_code	google_maps_rating	google_maps_review_count	notes	status	last_verified
1090	Restaurant Sant Martí	Sant Martí	Mediterranean	mid-range	likely		FALSE	https://santmarti-restaurant.es/		Sant Martí, Barcelona	08005	4.3	800	Est. 1969. Family business. Avant-garde + Med.	active	2026-03-23
1091	Aürt Barcelona	Sant Martí	Mediterranean	premium	none		FALSE			Sant Martí, Barcelona	08005	4.6	500	1 Michelin star. Chef Artur Martínez. Posh street food. Diagonal Mar Hotel.	active	2026-03-23
1092	Enoteca Paco Pérez	Sant Martí	Seafood	premium	none		FALSE			Sant Martí, Barcelona	08020	4.6	800	2 Michelin stars. Hotel Arts. Seafood haute cuisine.	active	2026-03-23
1093	Muysca Barcelona	Sant Martí	Colombian	mid-range	likely		FALSE			Sant Martí, Barcelona	08005	4.4	400	Colombian flavors in Sant Martí.	active	2026-03-23
1094	Locanda del Vulture	Sant Martí	Italian	mid-range	likely		FALSE			Sant Martí, Barcelona	08019	4.4	500	Quality Italian fare in Sant Martí.	active	2026-03-23
1095	Ultramarinos Marin	Sarrià-Sant Gervasi	Spanish	mid-range	likely		FALSE			Sarrià-Sant Gervasi, Barcelona	08017	4.4	500	Freshly baked bread + in-house charcuterie.	active	2026-03-23
1096	Parfum Cocktail Bar	Sarrià-Sant Gervasi	Spanish	mid-range	likely		FALSE			Sarrià-Sant Gervasi, Barcelona	08034	4.3	300	1920s-inspired cocktail bar.	active	2026-03-23
1097	Som Coffee Bar	Sarrià-Sant Gervasi	Café	budget	none		FALSE			Sarrià-Sant Gervasi, Barcelona	08017	4.3	200	Specialty coffee. Bar plates. Analog music.	active	2026-03-23
1098	Lombarda Poblenou	Poblenou	Vegetarian/Vegan	mid-range	none		FALSE			Poblenou, Barcelona	08019	4.3	300	2025. Veggie dishes + natural wines. Owner of long-standing Sésamo.	active	2026-03-23
1099	Jiribilla BCN	Sant Antoni	Mexican	mid-range	likely		FALSE			Sant Antoni, Barcelona	08015	4.3	300	2025. Mexican-inspired + elevated Catalan comfort food.	active	2026-03-23
1100	Aylul	Eixample	Mediterranean	mid-range	likely		FALSE			Eixample, Barcelona	08010	4.3	300	2025 opening. Mediterranean.	active	2026-03-23
1101	Parda Barcelona	Eixample	Spanish	mid-range	none		FALSE			Eixample, Barcelona	08015	4.3	200	2025. Steakhouse with live shows + cocktails.	active	2026-03-23
1102	GueBar	Eixample	Japanese	premium	none		FALSE			Eixample, Barcelona	08029	4.5	150	2025. Nikkei cuisine. Chef-driven bar for 10 guests.	active	2026-03-23
1103	Melodia Barcelona	Eixample	Greek	mid-range	likely		FALSE			Eixample, Barcelona	08029	4.3	200	2025. Greek café-bar. Authentic homemade + Greek wines.	active	2026-03-23
1104	Aspero	Eixample	Italian	mid-range	likely		FALSE			Eixample, Barcelona	08010	4.3	300	2025. Gourmet pizza + Catalan tapas.	active	2026-03-23
1105	Hankook BBQ	Eixample	Korean	mid-range	none		FALSE			Eixample, Barcelona	08007	4.2	400	2025. Korean all-you-can-eat BBQ + sushi.	active	2026-03-23
1106	Bar Dijous	Eixample	Catalan	mid-range	confirmed	13-16€	TRUE			Eixample, Barcelona	08036	4.3	300	2025. Catalan classics.	active	2026-03-23
1107	New Pamb	Eixample	Catalan	budget	none		FALSE			Eixample, Barcelona	08036	4.2	200	2025. Entrepans de forquilla (fork sandwiches).	active	2026-03-23
1108	L'Actiu	Eixample	Mediterranean	mid-range	confirmed	14.90€	TRUE			Eixample, Barcelona	08007	4.4	600	Modern menu. Changes daily. Seasonal. Vegan/vegetarian options.	active	2026-03-23
1109	La Muscleria	Eixample	Seafood	budget	confirmed	9.90€	TRUE			Eixample, Barcelona	08036	4.2	500	Mussels 50 ways. Budget menú from €9.90.	active	2026-03-23
1110	Bar Copèrnic	Eixample	Mediterranean	mid-range	confirmed	14€	TRUE			Eixample, Barcelona	08010	4.3	500	Three-course menú + drink + bread €14.	active	2026-03-23
1111	El Tastet de l'Artur	Sagrada Família	Catalan	budget	confirmed	11-14€	TRUE			Sagrada Família, Barcelona	08026	4.3	500	Family-run. Home-style Catalan. Menú del día.	active	2026-03-23
1112	Madre Taberna Moderna	Sagrada Família	Spanish	mid-range	likely		FALSE			Sagrada Família, Barcelona	08013	4.4	600	Creative tapas. Japanese fusion. Near Sagrada Familia.	active	2026-03-23
1113	Papanato Sagrada Familia	Sagrada Família	Argentine	mid-range	likely		FALSE			Sagrada Família, Barcelona	08013	4.2	400	Argentinian. Group menú available.	active	2026-03-23
1114	UMO Barcelona	Sarrià-Sant Gervasi	Japanese	premium	none		FALSE			Sarrià-Sant Gervasi, Barcelona	08034	4.5	200	11-seat tasting bar. Japanese technique + Med produce.	active	2026-03-23
1115	La Marimandona	Sarrià-Sant Gervasi	Mediterranean	mid-range	likely		FALSE			Sarrià-Sant Gervasi, Barcelona	08006	4.3	300	Classic dishes. High-quality ingredients.	active	2026-03-23
1116	Pino All Day Bar	Sarrià-Sant Gervasi	Café	budget	none		FALSE			Sarrià-Sant Gervasi, Barcelona	08006	4.2	200	All-day bar. Breakfast, coffee, cocktails. Pop-ups.	active	2026-03-23
1117	Fonda Balmes	Sarrià-Sant Gervasi	Catalan	mid-range	confirmed	14-18€	TRUE			Sarrià-Sant Gervasi, Barcelona	08034	4.3	300	2025 opening. Catalan classics.	active	2026-03-23
1118	La Taverna Gallega de Marcos	Sarrià-Sant Gervasi	Spanish	mid-range	likely		FALSE			Sarrià-Sant Gervasi, Barcelona	08034	4.4	400	Galician cuisine specialist.	active	2026-03-23
1119	El Disbarat	Gràcia	Catalan	mid-range	confirmed	13.90€	TRUE			Gràcia, Barcelona	08025	4.4	500	Catalan + modern twists. Creams, salads, canelons, fricandó. €13.90.	active	2026-03-23
1120	Siberia Poblenou	Poblenou	Mediterranean	mid-range	confirmed	13€	TRUE			Poblenou, Barcelona	08005	4.2	400	Traditional menú €13. Alternative to brunch scene.	active	2026-03-23
1121	Sopa Barcelona	Poblenou	Vegetarian/Vegan	mid-range	confirmed	12-14€	TRUE			Poblenou, Barcelona	08019	4.3	400	Healthy vegetarian/vegan menus. Tranquil setting.	active	2026-03-23
1122	Sra. Dolores	Sant Antoni	Spanish	budget	none		FALSE			Sant Antoni, Barcelona	08011	4.3	400	Fried dishes specialist. Vermouth + tapas.	active	2026-03-23
1123	Bar Chiqui Sushi	Sant Antoni	Fusion	budget	none		FALSE			Sant Antoni, Barcelona	08011	4.2	300	Traditional bodega + sushi bar. Tapas + Japanese.	active	2026-03-23
1124	Lora SLS Barcelona	Barri Gòtic	Lebanese	mid-range	none		FALSE			Barri Gòtic, Barcelona	08002	4.4	200	2026. Lebanese + Spanish fusion. SLS Hotel.	active	2026-03-23
1125	Voro at Veraz	Barri Gòtic	Mediterranean	premium	none		FALSE			Barri Gòtic, Barcelona	08002	4.6	200	Pop-up until autumn 2026. Mallorcan Med. 6-course tasting €68.	active	2026-03-23
1126	Dagma Barcelona	El Born	Mediterranean	mid-range	likely		FALSE			El Born, Barcelona	08003	4.3	200	2025. Creative Med + innovative fusions. Hotel Princess.	active	2026-03-23
1127	Que Bo Raval	El Raval	Middle Eastern	budget	none		FALSE			El Raval, Barcelona	08001	4.2	400	Middle Eastern-inspired. Halal. Durum, falafels, tajine.	active	2026-03-23
1128	Lora at Camp Nou	Les Corts	Mediterranean	mid-range	likely		FALSE			Les Corts, Barcelona	08028	4.3	200	Near renovated Camp Nou area.	active	2026-03-23
1129	Falamanki	Eixample	Lebanese	mid-range	likely		FALSE			Eixample, Barcelona	08009	4.3	300	Lebanese restaurant.	active	2026-03-23
1130	Ramen House Barcelona	Eixample	Japanese	budget	none		FALSE			Eixample, Barcelona	08011	4.2	500	Japanese ramen. €5-10.	active	2026-03-23
1131	Ikenoan	Eixample	Japanese	mid-range	none		FALSE			Eixample, Barcelona	08008	4.3	200	2025. Traditional Japanese teahouse. Expansion of Ikenocha.	active	2026-03-23
1132	Just Coffee BCN	Eixample	Café	budget	none		FALSE			Eixample, Barcelona	08010	4.3	200	2025. Specialty coffee.	active	2026-03-23
1133	Mooi Matcha	Sagrada Família	Café	budget	none		FALSE			Sagrada Família, Barcelona	08025	4.2	200	2025. Matcha + coffee.	active	2026-03-23
1134	Mayombe Barcelona	Eixample	Cuban	mid-range	likely		FALSE			Eixample, Barcelona	08009	4.2	200	2025. Cuban food. Aston Hotel.	active	2026-03-23
1135	El Tastet de la Rambla	Barri Gòtic	Catalan	budget	confirmed	11-14€	TRUE			Barri Gòtic, Barcelona	08002	4.2	400	Traditional Catalan. Menú del día.	active	2026-03-23
1136	Can Culleretes Gòtic	Barri Gòtic	Catalan	mid-range	confirmed	14-17€	TRUE	https://culleretes.com/	+34 933173022	Barri Gòtic, Barcelona	08002	4.3	2500	Barcelona oldest restaurant est. 1786. Traditional Catalan.	active	2026-03-23
1137	Teresa Carles Eixample	Eixample	Vegetarian/Vegan	mid-range	confirmed	14-17€	TRUE	https://teresacarles.com/	+34 933172979	Eixample, Barcelona	08029	4.4	3000	Famous vegetarian restaurant. Creative vegetarian haute cuisine.	active	2026-03-23
1138	Flax&Kale	El Raval	Vegetarian/Vegan	mid-range	likely		FALSE	https://flaxandkale.com/	+34 933175664	C/ dels Tallers, 74b, 08001 Barcelona	08001	4.3	2500	Flexitarian restaurant. Healthy + creative. Teresa Carles group.	active	2026-03-23
1139	Cervecería Catalana Eixample	Eixample	Spanish	mid-range	likely		FALSE	https://cerveceriacatalana.com/	+34 932160368	C/ de Mallorca, 236	08010	4.3	8000	Iconic tapas bar. Always busy. No reservations.	active	2026-03-23
1140	Can Cortada Restaurant	Horta-Guinardó	Catalan	mid-range	confirmed	15-20€	TRUE	https://cancortada.com/	+34 934272315	Av. de l'Estatut de Catalunya, s/n	08035	4.4	1200	Historic masia. 12-hour lamb. Near Horta labyrinth.	active	2026-03-23
1141	El Asador de Aranda Tibidabo	Sarrià-Sant Gervasi	Catalan	mid-range	confirmed	18-25€	TRUE	https://asadordearanda.com/	+34 934170115	Av. del Tibidabo, 31, 08035 Barcelona	08006	4.4	2000	Wood-fired oven. Spectacular views from Tibidabo.	active	2026-03-23
1142	Bar Mut Eixample	Eixample	Spanish	mid-range	likely		FALSE			Eixample, Barcelona	08011	4.4	1500	Iconic neighborhood bar. Wine + tapas.	active	2026-03-23
1143	Ramen Ya Hiro	Eixample	Japanese	budget	none		FALSE			Eixample, Barcelona	08009	4.3	800	Authentic ramen specialist.	active	2026-03-23
1144	Gelato Lab	Eixample	Italian	budget	none		FALSE			Eixample, Barcelona	08009	4.5	300	Artisan gelato lab.	active	2026-03-23
1145	La Bodegueta Provença	Eixample	Spanish	budget	confirmed	11-14€	TRUE			Eixample, Barcelona	08011	4.2	600	Traditional bodega. Budget menú.	active	2026-03-23
1146	Casa Amàlia	Eixample	Catalan	mid-range	confirmed	14-17€	TRUE			Eixample, Barcelona	08036	4.3	800	Traditional Catalan. Passatge del Mercat.	active	2026-03-23
1147	Les Truites	Eixample	Spanish	budget	confirmed	10-12€	TRUE			Eixample, Barcelona	08010	4.2	500	Specialist in tortillas. Budget menú.	active	2026-03-23
1148	Da Greco	Eixample	Italian	mid-range	likely		FALSE			Eixample, Barcelona	08029	4.3	600	Italian trattoria. Homemade pasta.	active	2026-03-23
1149	El Filete Ruso	Eixample	Spanish	mid-range	likely		FALSE			Eixample, Barcelona	08010	4.3	400	Classic Spanish comfort. Hearty portions.	active	2026-03-23
1150	La Plassohla	Eixample	Catalan	mid-range	confirmed	14-16€	TRUE			Eixample, Barcelona	08008	4.3	400	Traditional Catalan home cooking. Daily menú.	active	2026-03-23
1151	La Nena Gràcia	Gràcia	Café	budget	none		FALSE			Gràcia, Barcelona	08012	4.3	600	Family-friendly café. Hot chocolate.	active	2026-03-23
1152	Botafumeiro Gràcia	Gràcia	Seafood	premium	none		FALSE	https://botafumeiro.es/	+34 932184230	Gran de Gràcia, 81, 08012 Barcelona	08024	4.3	2000	Galician seafood institution. Premium shellfish.	active	2026-03-23
1153	La Vermutería del Tano	Gràcia	Spanish	budget	likely		FALSE			Gràcia, Barcelona	08024	4.2	400	Local vermutería. Tapas + vermouth.	active	2026-03-23
1154	Tunateca Balfegó	Gràcia	Seafood	premium	none		FALSE			Gràcia, Barcelona	08024	4.5	500	Tuna specialist. Premium concept.	active	2026-03-23
1155	Casa Leopoldo	El Raval	Catalan	mid-range	confirmed	15-20€	TRUE	https://casaleopoldo.com/	+34 933127385	C/ de Sant Rafael, 24	08001	4.3	1000	Historic Catalan tavern. Since 1929.	active	2026-03-23
1156	El Pla dels Àngels	El Raval	Mediterranean	mid-range	confirmed	13-16€	TRUE			El Raval, Barcelona	08001	4.2	600	Near MACBA. Good menú del día.	active	2026-03-23
1157	Ca l Isidre	El Raval	Catalan	premium	none		FALSE			El Raval, Barcelona	08001	4.5	800	Legendary Catalan fine dining. Since 1970. King Juan Carlos regular.	active	2026-03-23
1158	La Llesca del Born Poblenou	Poblenou	Spanish	budget	confirmed	10-13€	TRUE			Poblenou, Barcelona	08005	4.2	400	Budget menú. Quick lunch.	active	2026-03-23
1159	Boo Restaurant	Poblenou	Mediterranean	mid-range	likely		FALSE			Poblenou, Barcelona	08018	4.3	400	Modern Mediterranean. Creative menu.	active	2026-03-23
1160	The Green Spot	Poblenou	Vegetarian/Vegan	mid-range	likely		FALSE			Poblenou, Barcelona	08019	4.3	500	Vegetarian by Grupo Tragaluz. Creative veg cuisine.	active	2026-03-23
1161	Agut Barri Gòtic	Barri Gòtic	Catalan	mid-range	confirmed	14-18€	TRUE	http://www.restaurantagut.com/	+34 933151709	C/ d'en Gignàs, 16	08002	4.3	600	Since 1924. Traditional Catalan.	active	2026-03-23
1162	Milk Bar Gòtic	Barri Gòtic	Café	mid-range	none		FALSE			Barri Gòtic, Barcelona	08002	4.2	800	Cocktails + brunch. Vintage vibe.	active	2026-03-23
1163	Cal Pep Born	El Born	Seafood	mid-range	likely		FALSE	https://www.calpep.com/	+34 933107961	Plaça de les Olles, 8	08003	4.5	3000	Legendary seafood tapas. Bar seating. No reservations.	active	2026-03-23
1164	El Xampanyet Born	El Born	Spanish	budget	likely		FALSE	https://elxampanyet.es/	+34 933197003	C/ de Montcada, 22	08003	4.4	2000	Iconic cava bar. Blue tile interior. Traditional.	active	2026-03-23
1165	Quimet i Quimet Poble Sec	Poble Sec	Spanish	budget	likely		FALSE	https://www.quimetquimet.com/	+34 934423142	C/ del Poeta Cabanyes, 25	08004	4.5	4000	Legendary standing-only tapas bar. Montaditos. Tinned fish.	active	2026-03-23
1166	Tickets Successor	Poble Sec	Spanish	mid-range	likely		FALSE			Poble Sec, Barcelona	08004	4.3	300	New concept in Poble Sec.	active	2026-03-23
1167	La Cova Fumada Barceloneta	Barceloneta	Seafood	budget	likely		FALSE		+34 932214061	C/ del Baluard, 56	08003	4.4	3000	Legendary. Bomba de la Barceloneta inventor. No-frills.	active	2026-03-23
1168	Set Portes Barceloneta	Barceloneta	Catalan	mid-range	likely		FALSE	https://7portes.com/	+34 933193033	Passeig d'Isabel II, 14	08003	4.3	5000	Since 1836. Iconic paella. Historic dining room.	active	2026-03-23
1169	Vaso de Oro Barceloneta	Barceloneta	Spanish	budget	likely		FALSE		+34 933193098	C/ de Balboa, 6	08003	4.3	2500	Iconic tapas bar. Own-brewed beer. Stand-up only.	active	2026-03-23
1170	La Mundana Sants	Sants	Spanish	mid-range	likely		FALSE			Sants, Barcelona	08014	4.5	1200	Creative tapas. Elevated local dining.	active	2026-03-23
1171	Casa Pagès Sants	Sants	Catalan	budget	confirmed	11-14€	TRUE			Sants, Barcelona	08028	4.2	400	Traditional Catalan. Local menú.	active	2026-03-23
1172	Restaurant Nou Barris	Nou Barris	Catalan	budget	confirmed	10-13€	TRUE			Nou Barris, Barcelona	08042	4.1	300	Local Catalan. Budget menú.	active	2026-03-23
1173	El Cim del Nord	Nou Barris	Mediterranean	mid-range	confirmed	12-15€	TRUE			Nou Barris, Barcelona	08031	4.2	300	Mediterranean. Menú del día.	active	2026-03-23
1174	La Cuina de Sant Andreu	Sant Andreu	Catalan	budget	confirmed	11-14€	TRUE			Sant Andreu, Barcelona	08030	4.2	400	Local Catalan cooking. Traditional menú.	active	2026-03-23
1175	El Petit Andreu	Sant Andreu	Spanish	budget	confirmed	10-13€	TRUE			Sant Andreu, Barcelona	08030	4.1	300	Small neighborhood spot. Budget menú.	active	2026-03-23
1176	El Racó del Clot	Clot	Catalan	mid-range	confirmed	13-16€	TRUE			Clot, Barcelona	08026	4.3	500	Traditional Catalan. Menú del día.	active	2026-03-23
1177	Casa de Tapes Cañota SF	Sagrada Família	Spanish	mid-range	likely		FALSE			Sagrada Família, Barcelona	08026	4.3	600	Tapas specialist near Sagrada Familia.	active	2026-03-23
1178	Il Forno di Sabatini	Sagrada Família	Italian	mid-range	likely		FALSE			Sagrada Família, Barcelona	08013	4.2	500	Italian near Sagrada Família. Pizza + pasta.	active	2026-03-23
1179	La Flauta Sagrada Família	Sagrada Família	Mediterranean	mid-range	confirmed	15-18€	TRUE			Sagrada Família, Barcelona	08026	4.3	600	Mediterranean. Sister to Eixample original.	active	2026-03-23
1180	Can Paixano La Xampanyeria	Barceloneta	Spanish	budget	likely		FALSE	https://www.canpaixano.com/	+34 933100839	C/ de la Reina Cristina, 7	08003	4.2	8000	Legendary cava bar. Standing room. Tiny sandwiches.	active	2026-03-23
1181	Paradiso Barcelona	El Born	Café	mid-range	none		FALSE	https://www.paradiso.cat/	+34 936076085	C/ de Rera Palau, 4	08003	4.5	5000	World's Best Bar. Hidden behind pastrami shop.	active	2026-03-23
1182	Nectari Barcelona	Eixample	Mediterranean	premium	none		FALSE			Eixample, Barcelona	08015	4.5	700	1 Michelin star. Chef Jordi Esteve.	active	2026-03-23
1183	Roca Moo	Eixample	Mediterranean	premium	none		FALSE			Eixample, Barcelona	08007	4.5	600	1 Michelin star. Hotel Omm. Roca brothers.	active	2026-03-23
1184	Pur Eixample	Eixample	Mediterranean	mid-range	likely		FALSE			Eixample, Barcelona	08007	4.3	400	Modern Mediterranean bistro.	active	2026-03-23
1185	Speakeasy Barcelona	Eixample	Mediterranean	premium	none		FALSE			Eixample, Barcelona	08010	4.4	1000	Hidden behind Dry Martini bar. Fine dining.	active	2026-03-23
1186	La Boqueria Market Bar	El Raval	Spanish	budget	none		FALSE	https://boqueria.barcelona/	+34 934132303	La Rambla, 91	08001	4.0	5000	Market stalls offering fresh food at La Boqueria.	active	2026-03-23
1187	Cañete Barcelona	El Raval	Spanish	mid-range	likely		FALSE	https://barcanete.com/	+34 932703458	C/ de la Unió, 17	08001	4.5	3000	Premium tapas bar. Open kitchen.	active	2026-03-23
1188	Koy Shunka Gòtic	Barri Gòtic	Japanese	premium	none		FALSE			Barri Gòtic, Barcelona	08002	4.6	1500	1 Michelin star. Japanese-Catalan fusion. Chef Hideki Matsuhisa.	active	2026-03-23
1189	Sagardi Barcelona	El Born	Basque	mid-range	likely		FALSE	https://www.sagardi.com/	+34 933199993	C/ de l'Argenteria, 62	08003	4.2	2000	Basque cuisine. Pintxos bar + restaurant.	active	2026-03-23
1190	Sensi Bistro	Barri Gòtic	Mediterranean	mid-range	confirmed	14-17€	TRUE	https://sensibistro.com/	+34 933199854	C/ d'Ample, 26	08002	4.3	500	Mediterranean bistro. Good menú del día.	active	2026-03-23
1191	Ferrum Restaurant	Barri Gòtic	Mediterranean	mid-range	confirmed	14-18€	TRUE	https://ferrumrestaurant.com/	+34 933101230	C/ de la Fusina, 11	08002	4.3	400	Modern Mediterranean. Gallery setting.	active	2026-03-23
1192	La Basculla	El Born	Vegetarian/Vegan	mid-range	confirmed	12-15€	TRUE	https://labasculla.cat/	+34 933189098	C/ de la Flassaders, 30	08003	4.3	500	Cooperatively-run. Vegetarian menú del día.	active	2026-03-23
1193	Can Toni	Sants	Catalan	budget	confirmed	10-13€	TRUE		+34 934315135	C/ de la Creu Coberta, 46	08014	4.2	400	Traditional Catalan. Local menú.	active	2026-03-23
1194	Bar Leo	Poble Sec	Spanish	budget	confirmed	10-12€	TRUE		+34 934431011	C/ de Blai, 59	08004	4.1	400	Simple tasty menú. Very budget.	active	2026-03-23
1195	Oleum MNAC	Poble Sec	Mediterranean	mid-range	likely		FALSE	https://oleumrestaurant.com/	+34 932890679	Palau Nacional, Parc de Montjuïc	08004	4.3	400	Inside MNAC museum. Spectacular city views.	active	2026-03-23
1196	Kaiku Barceloneta	Barceloneta	Seafood	mid-range	likely		FALSE	http://restaurantkaiku.cat/	+34 932219082	Barceloneta, Barcelona	08003	4.4	1500	Popular seafood near beach. Paella specialist.	active	2026-03-23
1197	Filferro Barcelona	Barceloneta	Mediterranean	mid-range	likely		FALSE		+34 936240149	Pg. de Joan de Borbó, 22	08003	4.3	600	Mediterranean near marina. Fresh seafood.	active	2026-03-23
1198	Estimar Barcelona	Eixample	Seafood	premium	none		FALSE	https://estimar.cat/	+34 932079256	C/ de Mallorca, 213	08010	4.5	800	Rafa Zafra. Premium seafood. Pg de Gràcia.	active	2026-03-23
1199	Cervecería Vaso de Oro	Barceloneta	Spanish	budget	likely		FALSE		+34 933193098	C/ de Balboa, 6	08003	4.3	2500	Own-brewed beer. Stand-up tapas.	active	2026-03-23
1200	Bacaro Venice Wine Bar	El Born	Italian	mid-range	likely		FALSE			El Born, Barcelona	08003	4.3	400	Italian wine bar. Small plates.	active	2026-03-23
1201	La Ribera Born Tapas	El Born	Spanish	budget	confirmed	11-14€	TRUE			El Born, Barcelona	08003	4.2	500	Traditional tapas. Born location. Budget menú.	active	2026-03-23
1202	La Cuina del Raval	El Raval	Catalan	budget	confirmed	10-13€	TRUE			El Raval, Barcelona	08001	4.1	400	Budget Catalan menú. Raval local.	active	2026-03-23
1203	Restaurante Sagrada Familia	Sagrada Família	Mediterranean	mid-range	confirmed	14-17€	TRUE			Sagrada Família, Barcelona	08013	4.2	600	Mediterranean. Tourist + local trade near Sagrada Familia.	active	2026-03-23
1204	El Rincón de Gràcia	Gràcia	Spanish	budget	confirmed	11-14€	TRUE			Gràcia, Barcelona	08025	4.2	500	Neighborhood corner bar. Budget menú.	active	2026-03-23
1205	La Llesca Sant Martí	Sant Martí	Catalan	budget	likely						08019	4.2	450	Budget-friendly catalan. in Sant Martí. 4.2★ (450 reviews). Menú del día likely available.	active	2025-03-01
1206	Can Muns	Sant Martí	Spanish	budget	confirmed	11-14€					08019	4.1	380		active	2025-03-01
1207	Restaurant El Faro	Sant Martí	Seafood	mid-range	likely						08019	4.3	520	Seafood restaurant. in Sant Martí. 4.3★ (520 reviews). Menú del día likely available.	active	2025-03-01
1208	Restaurant Betúlia	Sant Martí	Mediterranean	mid-range	likely						08019	4.3	340	Mediterranean restaurant. in Sant Martí. 4.3★ (340 reviews). Menú del día likely available.	active	2025-03-01
1209	Tívoli Sant Martí	Sant Martí	Spanish	budget	confirmed	10-13€					08020	4.0	290		active	2025-03-01
1210	Ca la Margarida	Sant Martí	Catalan	mid-range	confirmed	12-15€					08019	4.2	410		active	2025-03-01
1211	Trópico Sant Martí	Sant Martí	Fusion	budget	likely						08019	4.1	320	Budget-friendly fusion. in Sant Martí. 4.1★ (320 reviews). Menú del día likely available.	active	2025-03-01
1212	Bar Restaurante El Recó	Sant Martí	Spanish	budget	confirmed	10-12€					08020	4.0	250		active	2025-03-01
1213	La Masia de Sant Martí	Sant Martí	Catalan	mid-range	confirmed	13-16€					08020	4.3	480		active	2025-03-01
1214	El Rincón Gallego Sant Martí	Sant Martí	Spanish	mid-range	likely						08019	4.1	350	Spanish restaurant. in Sant Martí. 4.1★ (350 reviews). Menú del día likely available.	active	2025-03-01
1215	Pizzería Da Michele Sant Martí	Sant Martí	Italian	mid-range	none						08019	4.5	1200	Italian restaurant. in Sant Martí. Highly rated (4.5★, 1,200 reviews)	active	2025-03-01
1216	Wok Garden Sant Martí	Sant Martí	Fusion	budget	likely						08019	3.9	600	Budget-friendly fusion. in Sant Martí. 3.9★ (600 reviews). Menú del día likely available.	active	2025-03-01
1217	La Taverna del Clínic Sant Martí	Sant Martí	Mediterranean	mid-range	likely						08020	4.2	370	Mediterranean restaurant. in Sant Martí. 4.2★ (370 reviews). Menú del día likely available.	active	2025-03-01
1218	Restaurant La Glorieta	Clot	Catalan	mid-range	confirmed	12-15€					08018	4.3	480		active	2025-03-01
1219	Bar Tano Clot	Clot	Spanish	budget	confirmed	10-12€					08018	4.1	320		active	2025-03-01
1220	El Bocata del Clot	Clot	Spanish	budget	likely						08018	4.0	250	Budget-friendly spanish. in Clot. 4.0★ (250 reviews). Menú del día likely available.	active	2025-03-01
1221	Osteria del Clot	Clot	Italian	mid-range	likely						08018	4.4	550	Italian restaurant. in Clot. Highly rated (4.4★, 550 reviews). Menú del día likely available.	active	2025-03-01
1222	Thai Corner Clot	Clot	Thai	budget	likely						08018	4.2	420	Budget-friendly thai. in Clot. 4.2★ (420 reviews). Menú del día likely available.	active	2025-03-01
1223	Can Pau Clot	Clot	Catalan	budget	confirmed	11-13€					08018	4.0	280		active	2025-03-01
1224	El Fogón del Clot	Clot	Spanish	budget	confirmed	10-13€					08018	4.1	310		active	2025-03-01
1225	La Cuina Oberta Clot	Clot	Mediterranean	mid-range	confirmed	12-15€					08018	4.3	400		active	2025-03-01
1226	Ramen Shifu Clot	Clot	Japanese	budget	likely						08018	4.3	650	Budget-friendly japanese. in Clot. 4.3★ (650 reviews). Menú del día likely available.	active	2025-03-01
1227	La Pizarra del Clot	Clot	Spanish	budget	confirmed	10-12€					08018	4.0	220		active	2025-03-01
1228	La Taquería Sagrada	Sagrada Família	Mexican	budget	likely						08013	4.2	780	Budget-friendly mexican. in Sagrada Família. 4.2★ (780 reviews). Menú del día likely available.	active	2025-03-01
1229	El Bar de la Sagrada	Sagrada Família	Spanish	budget	confirmed	10-12€					08013	4.0	350		active	2025-03-01
1230	Can Jordi Sagrada	Sagrada Família	Catalan	mid-range	confirmed	12-15€					08025	4.3	420		active	2025-03-01
1231	Osteria Sagrada	Sagrada Família	Italian	mid-range	likely						08013	4.4	900	Italian restaurant. in Sagrada Família. Highly rated (4.4★, 900 reviews). Menú del día likely available.	active	2025-03-01
1232	Himal Nepali Sagrada	Sagrada Família	Indian	budget	confirmed	9-12€					08025	4.5	340		active	2025-03-01
1233	La Parrilla de Lepant	Sagrada Família	Argentine	mid-range	likely						08013	4.1	430	Argentine restaurant. in Sagrada Família. 4.1★ (430 reviews). Menú del día likely available.	active	2025-03-01
1234	Bar El Temple	Sagrada Família	Spanish	budget	confirmed	10-13€					08025	4.0	280		active	2025-03-01
1235	Wok to Walk Sagrada	Sagrada Família	Fusion	budget	none						08013	3.8	520	Budget-friendly fusion. in Sagrada Família. 3.8★ (520 reviews)	active	2025-03-01
1236	Restaurant La Marina Sagrada	Sagrada Família	Seafood	mid-range	confirmed	13-16€					08025	4.2	380		active	2025-03-01
1237	El Rincón de Padilla	Sagrada Família	Spanish	budget	confirmed	10-12€					08013	4.1	310		active	2025-03-01
1238	Cal Pere Sant Andreu	Sant Andreu	Catalan	budget	confirmed	10-13€					08030	4.2	360		active	2025-03-01
1239	Restaurant El Molí	Sant Andreu	Mediterranean	mid-range	confirmed	12-15€					08030	4.3	420		active	2025-03-01
